{
  "$schema": "https://json-schema.org/draft/2020-12/schema",
  "$id": "https://raw.githubusercontent.com/SurreptitiousFabric/a-quo/main/schemas/omarchy-plugin-risk-v1/policy-result.schema.json",
  "title": "A Quo Omarchy plugin policy result candidate v1",
  "type": "object",
  "additionalProperties": false,
  "required": [
    "action",
    "decision",
    "enablement",
    "native_reports",
    "operation_id",
    "policy_sha256",
    "publisher_evidence_sha256",
    "reasons",
    "schema",
    "structural_record_sha256",
    "subject",
    "update_delta_sha256"
  ],
  "properties": {
    "action": {
      "enum": [
        "install",
        "update"
      ]
    },
    "decision": {
      "$ref": "common.schema.json#/$defs/policyDisposition"
    },
    "enablement": {
      "$ref": "common.schema.json#/$defs/enablementContext"
    },
    "native_reports": {
      "$ref": "common.schema.json#/$defs/nativeReportBindings"
    },
    "operation_id": {
      "$ref": "common.schema.json#/$defs/operationId"
    },
    "policy_sha256": {
      "$ref": "common.schema.json#/$defs/sha256"
    },
    "publisher_evidence_sha256": {
      "$ref": "common.schema.json#/$defs/sha256"
    },
    "reasons": {
      "type": "array",
      "minItems": 1,
      "maxItems": 4096,
      "items": {
        "$ref": "#/$defs/reason"
      },
      "x-a-quo-order": "strict tuple order: code in the declared enum order, disposition block before require_consent, provider_id null first then raw ASCII; duplicates forbidden"
    },
    "schema": {
      "const": "urn:a-quo:omarchy-plugin-policy-result:v1"
    },
    "structural_record_sha256": {
      "$ref": "common.schema.json#/$defs/sha256"
    },
    "subject": {
      "$ref": "common.schema.json#/$defs/manifestSubject"
    },
    "update_delta_sha256": {
      "oneOf": [
        {
          "$ref": "common.schema.json#/$defs/sha256"
        },
        {
          "type": "null"
        }
      ]
    }
  },
  "$defs": {
    "reason": {
      "type": "object",
      "additionalProperties": false,
      "required": [
        "code",
        "disposition",
        "provider_id"
      ],
      "properties": {
        "code": {
          "enum": [
            "interactive_approval_required",
            "publisher_not_authorized",
            "publisher_continuity_not_matched",
            "manifest_validator_not_passed",
            "missing_required_provider",
            "provider_incomplete",
            "provider_error",
            "provider_unsupported",
            "provider_not_run",
            "plugin_id_changed",
            "version_not_upgrade",
            "indeterminate_comparison"
          ]
        },
        "disposition": {
          "$ref": "common.schema.json#/$defs/policyDisposition"
        },
        "provider_id": {
          "oneOf": [
            {
              "$ref": "common.schema.json#/$defs/identifier"
            },
            {
              "type": "null"
            }
          ]
        }
      },
      "x-a-quo-semantic": "provider_id is required for missing_required_provider, provider status codes, and indeterminate_comparison; it is null for all other codes. interactive_approval_required is require_consent; publisher_not_authorized, publisher_continuity_not_matched, manifest_validator_not_passed, plugin_id_changed, and version_not_upgrade are block"
    }
  },
  "x-a-quo-semantic": "install requires null delta, a not-referenced observation, and leave-unreferenced intent; update requires a digest and preserve-reference-state intent for either referenced or not-referenced pre-operation state. Canonical input digests and deterministic reasons are recomputed from publisher, structural, opaque native-report integration status, update, and local-policy records; decision is block if any reason blocks, otherwise require_consent",
  "x-a-quo-nonclaim": "require_consent is a blocked-or-prompt-required parser result in Stage 0, not package eligibility, safety, or unattended authorization"
}
