{"action":"update","decision":"block","enablement":{"intent":"preserve_reference_state","pre_operation":"referenced","shell_config_sha256":"1ec38942769d432caaa7940f62b40a9d17ddebcca85a1a8123a2fe75ac4fdcf9","shell_config_source":"user"},"native_reports":[{"integration_status":"complete","native_report_schema":"urn:plug-prejudice:report:v2","native_report_sha256":"7777777777777777777777777777777777777777777777777777777777777777","native_report_size":2048,"provider_id":"static.analysis"}],"operation_id":"abababababababababababababababababababababababababababababababab","policy_sha256":"362b69c0b177687630ae8b40a3b2ca19c5ea9e4d63642082c803037ae3fd79d4","publisher_evidence_sha256":"511cd29535df69297531f6b1a2107f5d208dde6c61c87e1f746be50c0bd96f44","reasons":[{"code":"interactive_approval_required","disposition":"require_consent","provider_id":null},{"code":"indeterminate_comparison","disposition":"block","provider_id":"static.analysis"}],"schema":"urn:a-quo:omarchy-plugin-policy-result:v1","structural_record_sha256":"2ffc171f47ac80280bbecbb425f1ab5ad497401e2db588b793853a5f9fa78118","subject":{"analysis_stream_schema":"a-quo-regular-file-stream-v1","analysis_stream_sha256":"dddddddddddddddddddddddddddddddddddddddddddddddddddddddddddddddd","analysis_stream_size":223,"artifact_sha256":"cccccccccccccccccccccccccccccccccccccccccccccccccccccccccccccccc","artifact_size":120,"manifest_sha256":"3333333333333333333333333333333333333333333333333333333333333333","package_format":"omarchy-zstd-tar-v1","plugin_id":"test.risk-contract","plugin_version":"1.1.0"},"update_delta_sha256":"1e7f37d5f11b222a1ee47c0fd65a5f4fad17e07fc9daa19073e94ce8efc0252f"}