{"action":"update","decision":"block","enablement":{"intent":"preserve_reference_state","pre_operation":"referenced","shell_config_sha256":"24588cd9a05ba38ff2856bdc7fd1e95fcf0c91e594b542a1c5f175a90f020d63","shell_config_source":"user"},"native_reports":[{"integration_status":"complete","native_report_schema":"urn:example:oracle-report:v1","native_report_sha256":"c2c2c2c2c2c2c2c2c2c2c2c2c2c2c2c2c2c2c2c2c2c2c2c2c2c2c2c2c2c2c2c2","native_report_size":2048,"provider_id":"oracle.static"}],"operation_id":"d1d1d1d1d1d1d1d1d1d1d1d1d1d1d1d1d1d1d1d1d1d1d1d1d1d1d1d1d1d1d1d1","policy_sha256":"59807da15580d60660879d6c29e9e6d5b023213649b7be37ba50ce3e3f1c71d1","publisher_evidence_sha256":"331f30eac9946f09733e492619173af71c627f9ce7154244f91ebf755e03612d","reasons":[{"code":"interactive_approval_required","disposition":"require_consent","provider_id":null},{"code":"indeterminate_comparison","disposition":"block","provider_id":"oracle.static"}],"schema":"urn:a-quo:omarchy-plugin-policy-result:v1","structural_record_sha256":"7d6f3ce0328d0bccc2fb0f72f963a9ec7b5101f7d4607ca18f8167c1df7b353e","subject":{"analysis_stream_schema":"a-quo-regular-file-stream-v1","analysis_stream_sha256":"b9b9b9b9b9b9b9b9b9b9b9b9b9b9b9b9b9b9b9b9b9b9b9b9b9b9b9b9b9b9b9b9","analysis_stream_size":223,"artifact_sha256":"b0b0b0b0b0b0b0b0b0b0b0b0b0b0b0b0b0b0b0b0b0b0b0b0b0b0b0b0b0b0b0b0","artifact_size":120,"manifest_sha256":"b2b2b2b2b2b2b2b2b2b2b2b2b2b2b2b2b2b2b2b2b2b2b2b2b2b2b2b2b2b2b2b2","package_format":"omarchy-zstd-tar-v1","plugin_id":"org.a-quo.oracle","plugin_version":"2.1.0"},"update_delta_sha256":"874c999c1a97155cb462267e7f35971a1443f23827594c1351982847d687ef2a"}